"Trust","27th Jul 2020","28th Jul 2020","29th Jul 2020","30th Jul 2020","31st Jul 2020","1st Aug 2020","2nd Aug 2020","3rd Aug 2020","4th Aug 2020","5th Aug 2020","6th Aug 2020","7th Aug 2020","8th Aug 2020","9th Aug 2020","Total deaths reported in Trust so far","Crude rate deaths per 100,000 emergency catchment population"
"Brighton and Sussex University Hospitals NHS Trust",0,0,0,0,0,0,0,0,0,0,0,0,0,0,148,"27.6 per 100,000 (23.3-32.4)"
"East Sussex Healthcare NHS Trust",0,0,0,0,0,0,1,0,0,0,0,0,0,0,100,"27.4 per 100,000 (22.3-33.3)"
"Surrey and Sussex Healthcare NHS Trust",0,0,0,0,0,0,0,0,0,0,0,0,0,0,260,"68 per 100,000 (60-76.8)"
"Sussex Community NHS Foundation Trust",0,0,0,0,0,0,0,0,0,0,0,0,0,0,18,"-"
"Western Sussex Hospitals NHS Foundation Trust",0,0,0,0,0,0,0,0,0,0,0,0,0,0,113,"23.7 per 100,000 (19.5-28.5)"
"England",8,8,5,6,4,7,8,10,6,3,5,4,2,2,29419,"-"
